{"architecture":"arm64","capture_kind":"measured_local_host_provenance","host_coordinate_profile_sha256":"sha256:68dea05f281ca9ed41f2abad39d0d0e03e897ac423dbf244104af0af4238deb2","redaction":{"absolute_paths_absent":true,"account_identity_absent":true,"artifact_content_absent":true,"environment_secrets_absent":true},"schema_version":"s11-host-provenance/1.0","status":"passed","surfaces":[{"artifact_measurement":{"bytes":69984,"directories":0,"files":1,"kind":"regular_file"},"client_artifact_sha256":"sha256:68474c6192406b8a0278243c8283b87a84798a69fb498f30c3715861f8082542","client_bytes":270605984,"client_code_signature":{"cdhash":"dce9780d114a670768798d0dc0de4a96b422c309","identifier":"codex","mode":"strict","team_id":"2DC432GLL2","verified":true},"host_artifact_sha256":"sha256:f9aad3bbf4ab357f9c2e7d3503b42c86b2f43df60349bf8609fc373f46e446eb","host_code_signature":{"cdhash":"5f9c4b57e1aac976ebb4d686ac4e51244d24eac8","identifier":"com.openai.codex","mode":"deep_strict","team_id":"2DC432GLL2","verified":true},"host_metadata_sha256":null,"ide_shell_artifact_sha256":null,"ide_shell_code_signature":null,"surface":"app"},{"artifact_measurement":{"bytes":270605984,"directories":0,"files":1,"kind":"regular_file"},"client_artifact_sha256":"sha256:68474c6192406b8a0278243c8283b87a84798a69fb498f30c3715861f8082542","client_bytes":270605984,"client_code_signature":{"cdhash":"dce9780d114a670768798d0dc0de4a96b422c309","identifier":"codex","mode":"strict","team_id":"2DC432GLL2","verified":true},"host_artifact_sha256":"sha256:68474c6192406b8a0278243c8283b87a84798a69fb498f30c3715861f8082542","host_code_signature":{"cdhash":"dce9780d114a670768798d0dc0de4a96b422c309","identifier":"codex","mode":"strict","team_id":"2DC432GLL2","verified":true},"host_metadata_sha256":null,"ide_shell_artifact_sha256":null,"ide_shell_code_signature":null,"surface":"cli"},{"artifact_measurement":{"bytes":471202226,"directories":12,"files":4408,"kind":"directory_tree"},"client_artifact_sha256":"sha256:fa0cb7c5f80e6a192563fcb1d9f98857f4a808a28cb29289400ed7110291bce4","client_bytes":267700976,"client_code_signature":{"cdhash":"34fe2ba0b5f1b88e294c8dca8caa8675806e05fa","identifier":"codex","mode":"strict","team_id":"2DC432GLL2","verified":true},"host_artifact_sha256":"sha256:ea66cea39f5c40d83079fe200251ac698afe285e4cb30d335e4ee6517ee7b8aa","host_code_signature":null,"host_metadata_sha256":"sha256:fa2a88ea55413183654f5613b14e744517ad7626d26a673403bdde83c73adea7","ide_shell_artifact_sha256":"sha256:e1e3268741a2658a22b31e82b58a42fa48be73f64fc2de006be48a2ba136b930","ide_shell_bytes":133376,"ide_shell_code_signature":{"cdhash":"a3881eda3a41e747728f32973acd265a08ee0d5a","identifier":"com.microsoft.VSCode","mode":"deep_strict","team_id":"UBF8T346G9","verified":true},"metadata_bytes":7463,"surface":"ide"}]}
