{"architecture":"arm64","capture_kind":"measured_local_host_provenance","host_coordinate_profile_sha256":"sha256:bf3a272c3373004cd22cd2223a717bf8d3cf577f56a5d2fd0cad66126a87b91e","redaction":{"absolute_paths_absent":true,"account_identity_absent":true,"artifact_content_absent":true,"environment_secrets_absent":true},"schema_version":"s11-host-provenance/1.0","status":"passed","surfaces":[{"artifact_measurement":{"bytes":69984,"directories":0,"files":1,"kind":"regular_file"},"client_artifact_sha256":"sha256:d96ae1ca1ff6fc8587842fa04c92d3ee4d31651a811c2f89b65fcfd9c28473e2","client_bytes":270605984,"client_code_signature":{"cdhash":"dce9780d114a670768798d0dc0de4a96b422c309","identifier":"codex","mode":"strict","team_id":"2DC432GLL2","verified":true},"host_artifact_sha256":"sha256:e184ce460ed0565166e295507ad9ae6d7003fa8bd5d2e2f2f9ee8b5602feb2d4","host_code_signature":{"cdhash":"9f7d645ec76f3543f788f58b1039b9069201fca2","identifier":"com.openai.codex","mode":"deep_strict","team_id":"2DC432GLL2","verified":true},"host_metadata_sha256":null,"ide_shell_artifact_sha256":null,"ide_shell_code_signature":null,"surface":"app"},{"artifact_measurement":{"bytes":270605984,"directories":0,"files":1,"kind":"regular_file"},"client_artifact_sha256":"sha256:d96ae1ca1ff6fc8587842fa04c92d3ee4d31651a811c2f89b65fcfd9c28473e2","client_bytes":270605984,"client_code_signature":{"cdhash":"dce9780d114a670768798d0dc0de4a96b422c309","identifier":"codex","mode":"strict","team_id":"2DC432GLL2","verified":true},"host_artifact_sha256":"sha256:d96ae1ca1ff6fc8587842fa04c92d3ee4d31651a811c2f89b65fcfd9c28473e2","host_code_signature":{"cdhash":"dce9780d114a670768798d0dc0de4a96b422c309","identifier":"codex","mode":"strict","team_id":"2DC432GLL2","verified":true},"host_metadata_sha256":null,"ide_shell_artifact_sha256":null,"ide_shell_code_signature":null,"surface":"cli"},{"artifact_measurement":{"bytes":471202226,"directories":12,"files":4408,"kind":"directory_tree"},"client_artifact_sha256":"sha256:fa0cb7c5f80e6a192563fcb1d9f98857f4a808a28cb29289400ed7110291bce4","client_bytes":267700976,"client_code_signature":{"cdhash":"34fe2ba0b5f1b88e294c8dca8caa8675806e05fa","identifier":"codex","mode":"strict","team_id":"2DC432GLL2","verified":true},"host_artifact_sha256":"sha256:ea66cea39f5c40d83079fe200251ac698afe285e4cb30d335e4ee6517ee7b8aa","host_code_signature":null,"host_metadata_sha256":"sha256:fa2a88ea55413183654f5613b14e744517ad7626d26a673403bdde83c73adea7","ide_shell_artifact_sha256":"sha256:e1e3268741a2658a22b31e82b58a42fa48be73f64fc2de006be48a2ba136b930","ide_shell_bytes":133376,"ide_shell_code_signature":{"cdhash":"a3881eda3a41e747728f32973acd265a08ee0d5a","identifier":"com.microsoft.VSCode","mode":"deep_strict","team_id":"UBF8T346G9","verified":true},"metadata_bytes":7463,"surface":"ide"}]}
